{
  "$schema": "https://json-schema.org/draft/2020-12/schema",
  "$id": "https://github.com/frankxai/human-mind-intelligence-system/schemas/quadrant-hypothesis.schema.json",
  "title": "Quadrant Hypothesis",
  "description": "A prediction derived from an Ofman quadrant: given an observed core quality, hypothesise the likely pitfall, the balancing challenge, and the allergy (what the person is most likely to be irritated by in others). Conditional, probabilistic, falsifiable, plural. Never a diagnosis or a personality verdict.",
  "type": "object",
  "required": ["quality", "from", "predictions"],
  "additionalProperties": false,
  "properties": {
    "schemaVersion": { "type": "string", "const": "0.1.0", "description": "Version of the human-mind schema family this document conforms to." },
    "quality": { "type": "string", "minLength": 1, "description": "English quality id this hypothesis is about." },
    "from": {
      "type": "array",
      "description": "The observation(s) this hypothesis derives from. Traceability is required — a prediction with no source observation is not allowed.",
      "items": {
        "type": "object",
        "required": ["construct", "observationRef", "confidence"],
        "additionalProperties": false,
        "properties": {
          "construct": { "type": "string", "const": "quality" },
          "observationRef": { "type": "string", "minLength": 1, "description": "Identifier of the source quality observation." },
          "confidence": { "type": "number", "minimum": 0, "maximum": 1, "description": "Confidence in the source observation. Caps every prediction confidence below." }
        }
      }
    },
    "predictions": {
      "type": "array",
      "description": "Competing hypotheses about quadrant positions and likely reactions. Confidences need not sum to 1.",
      "items": {
        "type": "object",
        "required": ["position", "response", "confidence", "falsifier"],
        "additionalProperties": false,
        "properties": {
          "position": { "type": "string", "enum": ["pitfall", "challenge", "allergy"], "description": "Which quadrant corner this prediction concerns." },
          "response": { "type": "string", "minLength": 1, "description": "The likely disposition or reaction, phrased conditionally." },
          "confidence": { "type": "number", "minimum": 0, "maximum": 1, "description": "Confidence in this prediction. Must be <= the source observation confidence in 'from'." },
          "evidence": { "type": "array", "items": { "type": "string" }, "default": [] },
          "falsifier": { "type": "string", "minLength": 1, "description": "A later observation that would disconfirm this prediction." }
        }
      }
    },
    "abstainOnLowEvidence": { "type": "boolean", "default": true }
  }
}
